,sentence,category,subcategory,domain,id,audio_quality,prosody_1,meaning_1,translation_1,audio_1,prosody_2,meaning_2,translation_2,audio_2
699,Delivery takes five to seven days,Intonation,,Customer Service,50001,1,Delivery takes five to seven days.,Informing the customer of the delivery timeframe.,配達には5〜7日かかります。,data/intonation/wavs/50001/50001_1_4.wav,Delivery takes five to seven days?,Asking for confirmation about the delivery timeframe.,配達には5〜7日かかりますか。,data/intonation/wavs/50001/50001_2_4.wav
700,You need the receipt for a refund,Intonation,,Customer Service,50002,2,You need the receipt for a refund.,Stating the policy regarding refunds.,領収書があれば返金できます。,data/intonation/wavs/50002/50002_1_0.wav,You need the receipt for a refund?,Confirming if the receipt is required for a refund.,返金には領収書が必要ですか？,data/intonation/wavs/50002/50002_2_4.wav
701,Your order will ship tomorrow,Intonation,,Customer Service,50006,1,Your order will ship tomorrow.,Providing information about the shipping date.,ご注文は明日発送されます。,data/intonation/wavs/50006/50006_1_0.wav,Your order will ship tomorrow?,Asking for confirmation about the shipping date.,ご注文は明日発送されますか？,data/intonation/wavs/50006/50006_2_4.wav
702,You can pay with a credit card,Intonation,,Customer Service,50007,2,You can pay with a credit card.,Informing about the accepted payment methods.,クレジットカードで支払えますよ。,data/intonation/wavs/50007/50007_1_0.wav,You can pay with a credit card?,Confirming if paying with a credit card is acceptable.,クレジットカードで支払えますか？,data/intonation/wavs/50007/50007_2_0.wav
703,The product comes with a user manual,Intonation,,Customer Service,50013,1,The product comes with a user manual.,Informing the customer that the product includes a user manual.,製品には取扱説明書が付属しています。,data/intonation/wavs/50013/50013_1_1.wav,The product comes with a user manual?,Asking if the product includes a user manual.,製品には取扱説明書が付属していますか？,data/intonation/wavs/50013/50013_2_4.wav
704,The sale starts tomorrow,Intonation,,Customer Service,50014,1,The sale starts tomorrow.,Informing about the start date of the sale.,セールは明日始まります。,data/intonation/wavs/50014/50014_1_0.wav,The sale starts tomorrow?,Asking for confirmation about the sale's start date.,セールは明日始まりますか？,data/intonation/wavs/50014/50014_2_4.wav
705,You need to finish the report,Intonation,,Workplace Communication,50015,2,You *NEED* to finish the report.,Firmly telling someone to complete the task.,報告書を仕上げる必要があります。,data/intonation/wavs/50015/50015_1_1.wav,You _need_ to finish the report?,Checking if someone is aware that they need to complete the task.,報告書を仕上げる必要があるの？,data/intonation/wavs/50015/50015_2_4.wav
706,The meeting is at three,Intonation,,Workplace Communication,50016,1,The meeting *IS* at three.,Stating the time of the meeting.,会議は三時です。,data/intonation/wavs/50016/50016_1_1.wav,The meeting _is_ at three?,Questioning or confirming the time of the meeting.,会議は三時ですか？,data/intonation/wavs/50016/50016_2_3.wav
707,She will present tomorrow,Intonation,,Workplace Communication,50017,1,*SHE* will present tomorrow.,Informing that she is scheduled to present.,彼女は明日発表します。,data/intonation/wavs/50017/50017_1_0.wav,_she_ will present tomorrow?,Asking for confirmation if she is the one presenting.,彼女が明日発表するんですか？,data/intonation/wavs/50017/50017_2_4.wav
708,We need more supplies,Intonation,,Workplace Communication,50018,2,We *NEED* more supplies.,Stating the necessity for additional supplies.,もっと物資が必要です。,data/intonation/wavs/50018/50018_1_4.wav,We _need_ more supplies?,Asking if more supplies are required.,もっと物資が必要ですか？,data/intonation/wavs/50018/50018_2_4.wav
709,We can use the new software,Intonation,,Workplace Communication,50020,2,We *CAN* use the new software.,Stating the possibility of using the new software.,新しいソフトウェアを使うことができます。,data/intonation/wavs/50020/50020_1_4.wav,We _can_ use the new software?,Asking if it is permissible to use the new software.,新しいソフトウェアを使ってもいいのですか？,data/intonation/wavs/50020/50020_2_4.wav
710,The deadline is tomorrow,Intonation,,Workplace Communication,50021,2,The *DEADLINE* is tomorrow.,Informing that the due date is the next day.,締め切りは明日です。,data/intonation/wavs/50021/50021_1_0.wav,The _deadline_ is tomorrow?,Clarifying or double-checking the due date.,締め切りは明日ですか？,data/intonation/wavs/50021/50021_2_5.wav
711,The project is on track,Intonation,,Workplace Communication,50024,1,The project is *ON* track.,Stating that the project is progressing as planned.,プロジェクトは順調に進んでいます。,data/intonation/wavs/50024/50024_1_0.wav,The project is _on_ track?,Asking for confirmation about the project's progress.,プロジェクトは順調に進んでいますか？,data/intonation/wavs/50024/50024_2_4.wav
712,The printer is out of paper,Intonation,,Workplace Communication,50027,2,The printer is *OUT* of paper.,Informing that the printer has no paper.,プリンターは紙が切れています。,data/intonation/wavs/50027/50027_1_1.wav,The printer is _out_ of paper?,Asking for confirmation about the printer's paper status.,プリンターは紙が切れていますか？,data/intonation/wavs/50027/50027_2_4.wav
713,We are working on the revision,Intonation,,Workplace Communication,50029,1,We *ARE* working on the revision.,Stating that the revision is currently in progress.,修正作業をしています。,data/intonation/wavs/50029/50029_1_1.wav,We _are_ working on the revision?,Checking if the revision is being worked on.,修正作業をしているのですか？,data/intonation/wavs/50029/50029_2_4.wav
714,She finished her homework,Intonation,,Teaching/Education,50030,1,She *FINISHED* her homework.,Stating that she completed her homework.,彼女は宿題を終わらせた。,data/intonation/wavs/50030/50030_1_4.wav,She _finished_ her homework?,Questioning whether she actually completed her homework.,彼女は宿題を終わらせたの？,data/intonation/wavs/50030/50030_2_4.wav
715,He is ready for the presentation,Intonation,,Teaching/Education,50032,2,He is *READY* for the presentation.,Assuring that he is prepared for the presentation.,彼はプレゼンの準備ができています。,data/intonation/wavs/50032/50032_1_1.wav,He is _ready_ for the presentation?,Questioning whether he is prepared for the presentation.,彼はプレゼンの準備ができているんですか？,data/intonation/wavs/50032/50032_2_4.wav
716,You understand the concept,Intonation,,Teaching/Education,50033,2,You *UNDERSTAND* the concept.,Affirming that the listener comprehends the concept.,あなたはその概念を理解している。,data/intonation/wavs/50033/50033_1_4.wav,You _understand_ the concept?,Seeking confirmation if the listener comprehends the concept.,あなたはその概念を理解していますか？,data/intonation/wavs/50033/50033_2_4.wav
717,The lesson is over,Intonation,,Teaching/Education,50034,2,The *LESSON* is over.,Informing that the lesson has concluded.,レッスンは終わりました。,data/intonation/wavs/50034/50034_1_4.wav,The _lesson_ is over?,Questioning whether the lesson has concluded.,レッスンは終わったの？,data/intonation/wavs/50034/50034_2_4.wav
718,She is the valedictorian,Intonation,,Teaching/Education,50036,2,She *IS* the valedictorian.,Stating that she holds the title of valedictorian.,彼女が首席卒業生だ。,data/intonation/wavs/50036/50036_1_4.wav,She _is_ the valedictorian?,Questioning whether she holds the title of valedictorian.,彼女が首席卒業生なの？,data/intonation/wavs/50036/50036_2_4.wav
719,You passed the exam,Intonation,,Teaching/Education,50038,2,You *PASSED* the exam.,Confirming that the person successfully completed the exam.,あなたは試験に合格した。,data/intonation/wavs/50038/50038_1_1.wav,You _passed_ the exam?,Questioning if the person successfully completed the exam.,あなたは試験に合格したの？,data/intonation/wavs/50038/50038_2_4.wav
720,The students need more practice,Intonation,,Teaching/Education,50041,1,The *STUDENTS* need more practice.,Stating that the students require additional practice.,生徒たちはもっと練習が必要です。,data/intonation/wavs/50041/50041_1_4.wav,The _students_ need more practice?,Questioning if the students require additional practice.,生徒たちはもっと練習が必要ですか？,data/intonation/wavs/50041/50041_2_0.wav
721,He is the new principal,Intonation,,Teaching/Education,50042,2,He is the *NEW* principal.,Informing someone that he is the new principal of the school.,彼が新しい校長です。,data/intonation/wavs/50042/50042_1_4.wav,He is the _new_ principal?,Questioning if he is the new principal of the school.,彼が新しい校長ですか？,data/intonation/wavs/50042/50042_2_4.wav
722,You picked up the toys,Intonation,,Parenting,50045,2,You *PICKED* up the toys.,Praising the action of picking up the toys.,あなたがおもちゃを片付けたんですね。,data/intonation/wavs/50045/50045_1_1.wav,You _picked_ up the toys?,Asking for confirmation if the toys were picked up.,おもちゃを片付けたんですか？,data/intonation/wavs/50045/50045_2_3.wav
723,She is ready for bed,Intonation,,Parenting,50046,2,She *IS* ready for bed.,Stating that she is ready to go to bed.,彼女は寝る準備ができている。,data/intonation/wavs/50046/50046_1_3.wav,She _is_ ready for bed?,Questioning if she is actually ready for bed.,彼女は本当に寝る準備ができているの？,data/intonation/wavs/50046/50046_2_0.wav
724,You washed your hands,Intonation,,Parenting,50047,2,You *WASHED* your hands.,Acknowledging or confirming the action of washing hands.,あなたは手を洗いました。,data/intonation/wavs/50047/50047_1_4.wav,You _washed_ your hands?,Questioning if the hands were actually washed.,あなたは手を洗ったのですか？,data/intonation/wavs/50047/50047_2_0.wav
725,He finished his homework,Intonation,,Parenting,50048,2,He *FINISHED* his homework.,Confirming that the homework is complete.,彼は宿題を終えた。,data/intonation/wavs/50048/50048_1_4.wav,He _finished_ his homework?,Asking for confirmation if the homework is finished.,彼は宿題を終えたのか？,data/intonation/wavs/50048/50048_2_4.wav
726,We are going to the park,Intonation,,Parenting,50049,2,We *ARE* going to the park.,Stating the plan to go to the park.,私たちは公園に行きます。,data/intonation/wavs/50049/50049_1_3.wav,We _are_ going to the park?,Questioning if going to the park is really happening.,私たちは公園に行くんですか？,data/intonation/wavs/50049/50049_2_4.wav
727,They have eaten their lunch,Intonation,,Parenting,50050,1,They *HAVE* eaten their lunch.,Confirming that lunch has been eaten.,彼らは昼食を食べました。,data/intonation/wavs/50050/50050_1_4.wav,They _have_ eaten their lunch?,Questioning if the lunch has indeed been eaten.,彼らは昼食を食べたのですか？,data/intonation/wavs/50050/50050_2_4.wav
728,You are ready for school,Intonation,,Parenting,50051,2,You *ARE* ready for school.,Affirming readiness for school.,あなたは学校の準備ができています。,data/intonation/wavs/50051/50051_1_4.wav,You _are_ ready for school?,Questioning readiness for school.,学校の準備はできていますか。,data/intonation/wavs/50051/50051_2_3.wav
729,Your room is clean,Intonation,,Parenting,50052,2,Your *ROOM* is clean.,Affirming the cleanliness of the room.,君の部屋はきれいだね。,data/intonation/wavs/50052/50052_1_1.wav,Your _room_ is clean?,Questioning if the room is actually clean.,君の部屋はきれいなの？,data/intonation/wavs/50052/50052_2_4.wav
730,The baby is sleeping,Intonation,,Parenting,50053,2,The *BABY* is sleeping.,Stating that the baby is currently asleep.,赤ちゃんが寝ています。,data/intonation/wavs/50053/50053_1_4.wav,The _baby_ is sleeping?,Questioning if the baby is indeed sleeping.,赤ちゃんが寝ていますか？,data/intonation/wavs/50053/50053_2_0.wav
731,He needs a nap,Intonation,,Parenting,50054,2,He *NEEDS* a nap.,Declaring that he requires a nap.,彼は昼寝が必要です。,data/intonation/wavs/50054/50054_1_3.wav,He _needs_ a nap?,Questioning if he actually needs a nap.,彼は昼寝が必要ですか？,data/intonation/wavs/50054/50054_2_0.wav
732,You fed the dog,Intonation,,Parenting,50055,2,You *FED* the dog.,Confirming the chore of feeding the dog.,あなたは犬に餌をやったんですね。,data/intonation/wavs/50055/50055_1_4.wav,You _fed_ the dog?,Seeking confirmation if the dog was fed.,あなたは犬に餌をやったの？,data/intonation/wavs/50055/50055_2_0.wav
733,We have enough diapers,Intonation,,Parenting,50056,2,We *HAVE* enough diapers.,Stating that there are sufficient diapers.,私たちには十分なおむつがあります。,data/intonation/wavs/50056/50056_1_4.wav,We _have_ enough diapers?,Asking if the quantity of diapers is sufficient.,おむつは十分にありますか？,data/intonation/wavs/50056/50056_2_0.wav
734,The bath is ready,Intonation,,Parenting,50057,2,The *BATH* is ready.,Stating that the bath is prepared.,お風呂が準備できました。,data/intonation/wavs/50057/50057_1_4.wav,The _bath_ is ready?,Questioning if the bath is really ready.,お風呂が本当に準備できましたか。,data/intonation/wavs/50057/50057_2_4.wav
735,She ate all her vegetables,Intonation,,Parenting,50058,2,She *ATE* all her vegetables.,Confirming that all the vegetables were eaten.,彼女は全ての野菜を食べた。,data/intonation/wavs/50058/50058_1_5.wav,She _ate_ all her vegetables?,Questioning if all the vegetables were actually eaten.,彼女は全ての野菜を食べたの？,data/intonation/wavs/50058/50058_2_4.wav
736,You went to the doctor,Intonation,,Parenting,50059,2,You *WENT* to the doctor.,Affirming the visit to the doctor.,あなたは医者に行ったんだね。,data/intonation/wavs/50059/50059_1_0.wav,You _went_ to the doctor?,Questioning if the doctor visit happened.,あなたは医者に行ったの？,data/intonation/wavs/50059/50059_2_0.wav
737,You need help with that,Intonation,,Friendship,50060,2,You need *HELP* with that.,Observing and stating that help is needed.,手伝いが必要だ。,data/intonation/wavs/50060/50060_1_4.wav,You need _help_ with that?,Asking if the person needs help.,手伝いが必要ですか。,data/intonation/wavs/50060/50060_2_4.wav
738,We should meet at the park,Intonation,,Friendship,50061,1,We *SHOULD* meet at the park.,Suggesting a meeting place with certainty.,公園で会うことにしましょう。,data/intonation/wavs/50061/50061_1_4.wav,We _should_ meet at the park?,Asking if meeting at the park is a good idea.,公園で会うべきでしょうか？,data/intonation/wavs/50061/50061_2_3.wav
739,We are going to watch a movie tonight,Intonation,,Friendship,50062,2,We *ARE* going to watch a movie tonight.,Confirming a plan to watch a movie tonight.,私たちは今夜映画を見る予定です。,data/intonation/wavs/50062/50062_1_0.wav,We _are_ going to watch a movie tonight?,Asking if there is a plan to watch a movie tonight.,私たちは今夜映画を見る予定ですか？,data/intonation/wavs/50062/50062_2_4.wav
740,You always know what to say,Intonation,,Friendship,50063,1,You always *KNOW* what to say.,Praising someone for always having the right words.,あなたはいつも何と言うべきかを知っていますね。,data/intonation/wavs/50063/50063_1_2.wav,You always _know_ what to say?,Asking if the person is always confident in knowing the right words.,あなたはいつも何と言うべきかを知っているのですか？,data/intonation/wavs/50063/50063_2_3.wav
741,You will bring the snacks,Intonation,,Friendship,50064,2,You *WILL* bring the snacks.,Assigning or confirming the task of bringing snacks.,あなたがスナックを持ってくるんでしょう。,data/intonation/wavs/50064/50064_1_4.wav,You _will_ bring the snacks?,Asking if the person will bring snacks.,あなたがスナックを持ってくるの？,data/intonation/wavs/50064/50064_2_1.wav
742,We should go to the beach,Intonation,,Friendship,50065,2,We *SHOULD* go to the beach.,Stating with certainty that going to the beach is a good idea.,ビーチに行くべきだ。,data/intonation/wavs/50065/50065_1_1.wav,We _should_ go to the beach?,Asking if going to the beach is a good idea.,ビーチに行くべき？,data/intonation/wavs/50065/50065_2_3.wav
743,You have my back,Intonation,,Friendship,50066,2,You *HAVE* my back.,Confidently stating that the person supports you.,あなたは私を支えてくれます。,data/intonation/wavs/50066/50066_1_1.wav,You _have_ my back?,Asking if the person supports you.,あなたは私を支えてくれるんですか。,data/intonation/wavs/50066/50066_2_4.wav
744,We are best friends,Intonation,,Friendship,50067,2,We *ARE* best friends.,Confirming the close relationship.,私たちは親友だよ。,data/intonation/wavs/50067/50067_1_0.wav,We _are_ best friends?,Asking to confirm the close relationship.,私たちは親友なの？,data/intonation/wavs/50067/50067_2_3.wav
745,You forgot your phone,Intonation,,Friendship,50068,2,You *FORGOT* your phone.,Telling someone they left their phone behind.,電話を忘れてますよ。,data/intonation/wavs/50068/50068_1_4.wav,You _forgot_ your phone?,Asking if they realize they left their phone behind.,電話を忘れたんですか？,data/intonation/wavs/50068/50068_2_4.wav
746,We are going to the concert,Intonation,,Friendship,50069,1,We *ARE* going to the concert.,Confirming the plan to go to the concert.,私たちはコンサートに行きます。,data/intonation/wavs/50069/50069_1_0.wav,We _are_ going to the concert?,Asking if the plan to go to the concert is still on.,私たちはコンサートに行くんですか？,data/intonation/wavs/50069/50069_2_4.wav
747,You are my best friend,Intonation,,Friendship,50070,2,You *ARE* my best friend.,Affirming the close relationship.,あなたが私の親友です。,data/intonation/wavs/50070/50070_1_4.wav,You _are_ my best friend?,Asking for confirmation about the close relationship.,あなたが私の親友なの？,data/intonation/wavs/50070/50070_2_1.wav
748,We will see each other tomorrow,Intonation,,Friendship,50071,2,We *WILL* see each other tomorrow.,Confidently stating plans for seeing each other.,私たちは明日会うつもりです。,data/intonation/wavs/50071/50071_1_0.wav,We _will_ see each other tomorrow?,Asking for confirmation about meeting plans.,私たちは明日会う予定ですか?,data/intonation/wavs/50071/50071_2_0.wav
749,You really enjoy hiking,Intonation,,Friendship,50072,2,You *REALLY* enjoy hiking.,Stating a known fact about someone's preference.,あなたは本当にハイキングが好きなんですね。,data/intonation/wavs/50072/50072_1_1.wav,You _really_ enjoy hiking?,Asking if the person truly enjoys hiking.,あなたは本当にハイキングが好きなの？,data/intonation/wavs/50072/50072_2_4.wav
750,This is the main point,Intonation,,Public Speaking,50074,1,This *IS* the main point.,Emphasizing what the main focus should be.,これが主なポイントです。,data/intonation/wavs/50074/50074_1_1.wav,This _is_ the main point?,Seeking confirmation that this is the main focus.,これが主なポイントですか？,data/intonation/wavs/50074/50074_2_4.wav
751,Your speech was impressive,Intonation,,Public Speaking,50075,2,Your speech *WAS* impressive.,Complimenting the quality of the speech.,あなたのスピーチは素晴らしかったです。,data/intonation/wavs/50075/50075_1_5.wav,Your speech _was_ impressive?,Questioning if the speech was really impressive.,あなたのスピーチは本当に素晴らしかったですか？,data/intonation/wavs/50075/50075_2_1.wav
752,Your conclusion was strong,Intonation,,Public Speaking,50078,2,Your *CONCLUSION* was strong.,Praising the strength of the conclusion.,あなたの結論はとても強かったです。,data/intonation/wavs/50078/50078_1_3.wav,Your _conclusion_ was strong?,Questioning if the conclusion was indeed strong.,あなたの結論はそんなに強かったですか？,data/intonation/wavs/50078/50078_2_0.wav
753,I should speak louder,Intonation,,Public Speaking,50080,2,I *SHOULD* speak louder.,Deciding to increase volume.,もっと大きな声で話すべきだ。,data/intonation/wavs/50080/50080_1_4.wav,I _should_ speak louder?,Questioning if speaking louder would be a good idea.,もっと大きな声で話すべきだろうか。,data/intonation/wavs/50080/50080_2_3.wav
754,The speech lasted an hour,Intonation,,Public Speaking,50081,1,The speech *LASTED* an hour.,Stating the duration of the speech.,スピーチは一時間続きました。,data/intonation/wavs/50081/50081_1_2.wav,The speech _lasted_ an hour?,Questioning if the speech really took an hour.,スピーチは一時間続いたのですか？,data/intonation/wavs/50081/50081_2_5.wav
755,The feedback was positive,Intonation,,Public Speaking,50082,2,The feedback was *POSITIVE*.,Indicating that the feedback received was favorable.,フィードバックは好意的でした。,data/intonation/wavs/50082/50082_1_1.wav,The feedback was _positive_?,Questioning if the feedback was indeed positive.,フィードバックは好意的だったんですか？,data/intonation/wavs/50082/50082_2_4.wav
756,I need a microphone,Intonation,,Public Speaking,50083,1,I *NEED* a microphone.,Stating the necessity of having a microphone.,マイクが必要です。,data/intonation/wavs/50083/50083_1_4.wav,I _need_ a microphone?,Questioning if a microphone is needed.,マイクが必要ですか？,data/intonation/wavs/50083/50083_2_3.wav
757,Everyone appreciated your talk,Intonation,,Public Speaking,50084,1,Everyone *APPRECIATED* your talk.,Stating that the audience liked the speech.,皆さんがあなたの話を感謝していましたよ。,data/intonation/wavs/50084/50084_1_5.wav,Everyone _appreciated_ your talk?,Questioning if the speech was appreciated by everyone.,皆さんがあなたの話を感謝したのでしょうか？,data/intonation/wavs/50084/50084_2_0.wav
758,This slide is very detailed,Intonation,,Public Speaking,50085,1,This slide is *VERY* detailed.,Noting the detailed nature of the slide.,このスライドはとても詳しいです。,data/intonation/wavs/50085/50085_1_0.wav,This slide _is_ very detailed?,Questioning if the slide is indeed detailed.,このスライドはとても詳しいのですか？,data/intonation/wavs/50085/50085_2_4.wav
759,We will start in five minutes,Intonation,,Public Speaking,50087,2,We *WILL* start in five minutes.,Informing about the start time.,私たちは5分後に開始します。,data/intonation/wavs/50087/50087_1_4.wav,We _will_ start in five minutes?,Questioning if the start time is in five minutes.,私たちは5分後に開始するんですか？,data/intonation/wavs/50087/50087_2_4.wav
760,The trial starts next week,Intonation,,Legal Proceedings,50090,2,The trial starts next week.,Informing about the trial's start date.,裁判は来週始まります。,data/intonation/wavs/50090/50090_1_4.wav,The trial starts next week?,Seeking confirmation about the trial's start date.,裁判は来週始まりますか？,data/intonation/wavs/50090/50090_2_4.wav
761,The jury reached a verdict,Intonation,,Legal Proceedings,50093,1,The jury reached a verdict.,Stating that the jury has come to a decision.,陪審員は評決に達しました。,data/intonation/wavs/50093/50093_1_2.wav,The jury reached a verdict?,Questioning whether the jury has come to a decision.,陪審員は評決に達したのですか？,data/intonation/wavs/50093/50093_2_0.wav
762,The judge dismissed the case,Intonation,,Legal Proceedings,50095,1,The judge dismissed the case.,Stating that the judge has thrown out the case.,裁判官は訴訟を却下しました。,data/intonation/wavs/50095/50095_1_0.wav,The judge dismissed the case?,Querying if the judge threw out the case.,裁判官は訴訟を却下したんですか？,data/intonation/wavs/50095/50095_2_0.wav
763,The court needs more evidence,Intonation,,Legal Proceedings,50096,2,The court needs more evidence.,Stating that additional evidence is required.,裁判所はもっと証拠が必要です。,data/intonation/wavs/50096/50096_1_4.wav,The court needs more evidence?,Questioning if additional evidence is required.,裁判所はもっと証拠が必要ですか？,data/intonation/wavs/50096/50096_2_3.wav
764,The witness was credible,Intonation,,Legal Proceedings,50097,2,The witness was credible.,Asserting that the witness was believable.,証人は信頼できました。,data/intonation/wavs/50097/50097_1_3.wav,The witness was credible?,Questioning the credibility of the witness.,証人は信頼できたのですか？,data/intonation/wavs/50097/50097_2_4.wav
765,The case was closed,Intonation,,Legal Proceedings,50098,2,The case was closed.,Stating that the case has been resolved.,事件は解決した。,data/intonation/wavs/50098/50098_1_1.wav,The case was closed?,Seeking confirmation that the case has been resolved.,事件は解決したのですか。,data/intonation/wavs/50098/50098_2_4.wav
