,sentence,category,subcategory,domain,id,audio_quality,prosody_1,meaning_1,translation_1,audio_1,prosody_2,meaning_2,translation_2,audio_2
1119,They just laughed about it.,Emotional Prosody,Sad-Angry,bullying reports,31001,1,They just... _laughed_ about it...,Shows sadness and disappointment over the lack of seriousness in their reaction.,それについて彼らはただ笑ったんだ。,data/emotional_prosody/wavs/31001/31001_1_3.wav,They *JUST LAUGHED* about _it_!?,Conveys anger and indignation over their dismissive reaction.,それについて彼らは笑っただけだ。,data/emotional_prosody/wavs/31001/31001_2_1.wav
1121,I really expected better.,Emotional Prosody,Sad-Angry,grievance filings,31081,1,I really expected _better_...,Indicates anger and disappointment due to unmet expectations.,本当に期待していたのに。,data/emotional_prosody/wavs/31081/31081_1_5.wav,I really expected!!! _better_!!!,Conveys a sense of disappointment and letdown from unmet expectations.,もっと期待していたのに。,data/emotional_prosody/wavs/31081/31081_2_0.wav
1122,Why didn't you report it earlier?,Emotional Prosody,Sad-Angry,harassment cases,31090,1,Why didn't you _report_ it... earlier......,Communicates a feeling of sadness and regret that the issue was not reported sooner.,なぜもっと早く報告しなかったのか。,data/emotional_prosody/wavs/31090/31090_1_3.wav,Why didn't you *REPORT* it *EARLIER*!,"Shows frustration and anger because the issue could have been addressed earlier, preventing further harm.",なぜもっと早く報告しなかったんだ。,data/emotional_prosody/wavs/31090/31090_2_5.wav
1123,Our case was dismissed.,Emotional Prosody,Sad-Angry,legal disputes,31098,1,Our case was _dismissed_...,Expresses intense frustration and disbelief that their legal case was thrown out.,私たちの訴訟が却下されるなんて。,data/emotional_prosody/wavs/31098/31098_1_5.wav,Our case was!!! _dismissed_!!!,Conveys deep disappointment and sorrow over the dismissal of their case.,私たちの訴訟は却下されたのか。,data/emotional_prosody/wavs/31098/31098_2_1.wav
1124,That was an amazing play.,Emotional Prosody,Happy-Angry,sports game reactions,31186,2,That was an *amazing* play!,Expresses genuine admiration and excitement for the impressive play.,素晴らしい試合だったね。,data/emotional_prosody/wavs/31186/31186_1_3.wav,That was an _amazing_ *PLAY*!,Sarcasm implying that the play was unimpressive or a mistake.,すごい試合だったな。,data/emotional_prosody/wavs/31186/31186_2_2.wav
1125,They're really playing well today.,Emotional Prosody,Happy-Angry,sports game reactions,31187,2,They're *really* playing well today!,Conveys excitement and satisfaction with the team's performance.,彼らは今日、本当によくプレーしているね。,data/emotional_prosody/wavs/31187/31187_1_1.wav,They're _really_ playing *WELL* today!,"Sarcasm, suggesting frustration that the performance isn't actually good.",今日は本当にうまくいってるね、まったく。,data/emotional_prosody/wavs/31187/31187_2_1.wav
1126,The coach made a strange decision.,Emotional Prosody,Happy-Angry,sports game reactions,31189,2,The coach made a *strange* decision!,Joyfully acknowledging an unconventional but beneficial choice.,コーチが奇妙な決定をした。,data/emotional_prosody/wavs/31189/31189_1_2.wav,The coach made a *STRANGE* decision!,Expresses anger and disbelief towards the coach's poor choice.,コーチはとんでもない決定をした。,data/emotional_prosody/wavs/31189/31189_2_2.wav
1127,I can't believe we won.,Emotional Prosody,Happy-Angry,sports game reactions,31190,1,I _can't believe_ we *won*!,Incredulous joy and excitement over the victory.,私たちが勝ったなんて、信じられないほど嬉しい。,data/emotional_prosody/wavs/31190/31190_1_4.wav,I can't believe *WE* _won_!,"Anger perhaps due to the other team playing even worse, implying we didn't deserve the win.",信じられない、私たちが勝ったなんて。,data/emotional_prosody/wavs/31190/31190_2_1.wav
1128,Our team is undefeated this season.,Emotional Prosody,Happy-Angry,sports game reactions,31192,1,Our team is *undefeated* this season!,Pride and joy in the team's flawless record.,私たちのチームは今シーズン無敗ですよ。,data/emotional_prosody/wavs/31192/31192_1_3.wav,Our _team_ is undefeated *THIS SEASON*!,Bitterness implying doubt or dissatisfaction despite the undefeated record.,私たちのチームは今シーズン無敗です。,data/emotional_prosody/wavs/31192/31192_2_1.wav
1130,We finally won the championship.,Emotional Prosody,Happy-Angry,competition results,31194,2,We _finally_ won the *championship*!,Signifies enormous joy and relief at achieving a long-awaited victory.,やっと私たちはチャンピオンシップに優勝しました。,data/emotional_prosody/wavs/31194/31194_1_4.wav,We *FINALLY* won the championship!,Expresses frustration and annoyance that it took so long to win the championship.,やっと私たちはチャンピオンシップに勝ったんだ。,data/emotional_prosody/wavs/31194/31194_2_3.wav
1131,We didn't make it to the finals.,Emotional Prosody,Happy-Angry,competition results,31196,2,We didn't make it to the *finals*!,Suggests that the speaker is relieved or happy about not having to deal with the pressure or hassle of the finals.,決勝に進出しなくて済んだね。,data/emotional_prosody/wavs/31196/31196_1_0.wav,We didn't *MAKE* it to the finals!,Shows anger and frustration about the failure to advance in the competition.,私たちは決勝に進むことができなかったんだ。,data/emotional_prosody/wavs/31196/31196_2_1.wav
1132,We almost won the match.,Emotional Prosody,Happy-Angry,competition results,31200,2,We *almost* won the match!,"Signals a positive outlook on the close result, possibly taking pride in the effort.",試合にもう少しで勝てた。,data/emotional_prosody/wavs/31200/31200_1_5.wav,We *ALMOST* won the match!,Expresses anger and frustration that they came so close but did not secure the win.,試合にほとんど勝てたのに。,data/emotional_prosody/wavs/31200/31200_2_1.wav
1133,The judges gave us high scores.,Emotional Prosody,Happy-Angry,competition results,31201,2,The judges gave us *high* scores!,Shows genuine joy and pride at receiving high marks from the judges.,審査員は私たちに高い点数をくれました。,data/emotional_prosody/wavs/31201/31201_1_4.wav,The judges gave us *HIGH* scores!,"Indicates anger or disbelief, possibly thinking the scores should have been even higher.",審査員は私たちに高得点をくれました。,data/emotional_prosody/wavs/31201/31201_2_1.wav
1134,The polls just closed.,Emotional Prosody,Happy-Angry,political election results,31204,1,The polls just _closed_!,"Excitement about the conclusion of voting, possibly anticipating favorable results.",投票がちょうど終わりましたよ。,data/emotional_prosody/wavs/31204/31204_1_5.wav,The polls just *CLOSED*!,"Frustration or anger about the polls closing, possibly suggesting unfairness or a missed opportunity.",投票が締め切られてしまいました。,data/emotional_prosody/wavs/31204/31204_2_2.wav
1135,The campaign strategies paid off.,Emotional Prosody,Happy-Angry,political election results,31210,1,The _campaign strategies_ paid *off*!,Happiness and satisfaction with the successful campaign tactics.,キャンペーン戦略がうまくいった。,data/emotional_prosody/wavs/31210/31210_1_3.wav,The _campaign strategies_ paid *OFF*!,"Anger, potentially from an opposite side, indicating frustration that the strategies worked.",あのキャンペーン戦略が効果を発揮した。,data/emotional_prosody/wavs/31210/31210_2_1.wav
1136,The market closed higher than expected.,Emotional Prosody,Happy-Angry,market fluctuations,31214,1,The market closed _higher than expected_!,Expresses joy and probably relief due to the market performing better than anticipated.,市場は予想よりも高くクローズし、嬉しい驚きでした。,data/emotional_prosody/wavs/31214/31214_1_2.wav,The market closed *HIGHER than expected*!,"Shows frustration, possibly because higher closing might imply missed opportunities or higher costs.",市場は予想よりも高くクローズしてしまいました。,data/emotional_prosody/wavs/31214/31214_2_0.wav
1137,Our stock value has surged recently.,Emotional Prosody,Happy-Angry,market fluctuations,31215,1,Our stock value has _surged_ recently!,Expresses excitement and satisfaction about the increase in stock value.,最近、うちの株価が急騰しました。,data/emotional_prosody/wavs/31215/31215_1_2.wav,Our stock value has *SURGED* recently!,"Conveys frustration, possibly indicating concerns about market volatility or increased pressure.",最近、私たちの株価が急上昇しました。,data/emotional_prosody/wavs/31215/31215_2_1.wav
1138,The prices have stabilized now.,Emotional Prosody,Happy-Angry,market fluctuations,31216,2,The prices have _stabilized_ now!,Shows contentment with the market returning to stability.,価格は今落ち着きました。,data/emotional_prosody/wavs/31216/31216_1_2.wav,The prices have *STABILIZED* now!,"Reflects anger, possibly due to missed opportunities during more volatile periods.",価格は今安定しました。,data/emotional_prosody/wavs/31216/31216_2_0.wav
1141,The new policy affected the market trends.,Emotional Prosody,Happy-Angry,market fluctuations,31219,1,The new policy affected _the market trends_!,Shows excitement over positive changes brought by the new policy.,新しい政策のおかげで市場の動向が良くなりました。,data/emotional_prosody/wavs/31219/31219_1_4.wav,The new policy *AFFECTED* the market trends!,"Reflects displeasure and anger, possibly due to negative impact from the new policy.",新しい政策が市場の動向に悪影響を与えました。,data/emotional_prosody/wavs/31219/31219_2_1.wav
1142,We need to review our market strategy.,Emotional Prosody,Happy-Angry,market fluctuations,31221,2,We need to _review_ our market strategy!,Shows enthusiasm and optimism about improving the strategy.,私たちは市場戦略を見直す必要がありますね。,data/emotional_prosody/wavs/31221/31221_1_2.wav,We need to *REVIEW* our market strategy!,Indicates anger and urgency due to current strategy's poor performance.,私たちは市場戦略を今すぐ見直す必要があります。,data/emotional_prosody/wavs/31221/31221_2_1.wav
1143,We met our deadline.,Emotional Prosody,Happy-Angry,team project outcomes,31225,2,We *met* our _deadline_!,Expresses happiness and pride in achieving the target on time.,私たちは締め切りに間に合いました。,data/emotional_prosody/wavs/31225/31225_1_3.wav,We _met_ *OUR* deadline!,Indicates irritation that meeting the deadline was difficult or stressful.,私たちはなんとか締め切りに間に合わせました。,data/emotional_prosody/wavs/31225/31225_2_5.wav
1144,We have to redo the entire report.,Emotional Prosody,Happy-Angry,team project outcomes,31228,2,We have to *redo* the _entire_ report.,"Implying a positive outlook, viewing it as an opportunity for improvement.",レポート全体を改めてやり直さなければなりませんね。,data/emotional_prosody/wavs/31228/31228_1_2.wav,We have to *REDO* the *ENTIRE* report!,Expresses frustration and anger at having to redo the work.,レポート全体をやり直さなければならないんだ。,data/emotional_prosody/wavs/31228/31228_2_1.wav
1145,Our teamwork was amazing.,Emotional Prosody,Happy-Angry,team project outcomes,31231,1,Our teamwork was *amazing*!,Conveys pride and joy in the collaborative effort.,チームワークは本当に素晴らしかった。,data/emotional_prosody/wavs/31231/31231_1_3.wav,Our teamwork was _amazing_!,"Indicates frustration, perhaps sarcastically suggesting it wasn't actually good.",チームワークは素晴らしかった。,data/emotional_prosody/wavs/31231/31231_2_1.wav
1146,We resolved all the issues.,Emotional Prosody,Happy-Angry,team project outcomes,31232,2,We *resolved* all the *issues*!,Shows happiness and relief at overcoming all problems.,私たちはどうにかすべての問題を解決しました。,data/emotional_prosody/wavs/31232/31232_1_4.wav,We _resolved_ all the *ISSUES*!,"Expresses frustration, possibly implying there were more issues than expected.",私たちはすべての問題を解決しました。,data/emotional_prosody/wavs/31232/31232_2_1.wav
1147,You really made my day today.,Emotional Prosody,Happy-Angry,customer service feedback,31235,2,You really *made* my _day_ today!,Shows that the customer is extremely pleased and happy with the service.,今日は本当に楽しい日になりました。,data/emotional_prosody/wavs/31235/31235_1_2.wav,You *REALLY* made my day *TODAY*!,Indicates that the customer is being sarcastic and is actually displeased by the service received.,今日は本当に酷い日になりました。,data/emotional_prosody/wavs/31235/31235_2_1.wav
1148,I can't believe how helpful everyone was.,Emotional Prosody,Happy-Angry,customer service feedback,31237,1,I can't believe how *helpful* everyone was!,Highlights the customer's pleasant surprise at the level of helpful service.,皆さんがどれほど親切に助けてくれたか信じられません。,data/emotional_prosody/wavs/31237/31237_1_4.wav,I can't _believe_ how _helpful_ everyone was!,Uses sarcasm to express disbelief and frustration at the unhelpful service.,皆さんがどれほど助けてくれたか信じられないよ。,data/emotional_prosody/wavs/31237/31237_2_1.wav
1150,Your team did a fantastic job.,Emotional Prosody,Happy-Angry,customer service feedback,31242,1,Your team did a *fantastic* job!,Praises the team for their excellent performance.,あなたのチームは本当に素晴らしい仕事をしましたね。,data/emotional_prosody/wavs/31242/31242_1_4.wav,Your team did a *FANTASTIC* job!,"Sarcastically states that the team did a poor job, expressing displeasure.",あなたのチームは本当に素晴らしい仕事をしました。,data/emotional_prosody/wavs/31242/31242_2_2.wav
1151,I think we have reached a consensus.,Emotional Prosody,Happy-Angry,debate conclusions,31244,1,I think we have _reached_ a *consensus*!,Expresses joy and satisfaction that all parties have agreed.,全員が合意に達して嬉しいです。,data/emotional_prosody/wavs/31244/31244_1_2.wav,I _think_ we have *REACHED* a consensus!,Suggests frustration or reluctance with the agreement reached.,合意には達したと思いますが、不満です。,data/emotional_prosody/wavs/31244/31244_2_1.wav
1152,Your points were very convincing.,Emotional Prosody,Happy-Angry,debate conclusions,31245,2,Your points were _very_ *convincing*!,Indicates enthusiasm and admiration for the convincing arguments presented.,あなたのポイントはとても説得力がありましたよ。,data/emotional_prosody/wavs/31245/31245_1_4.wav,Your points were *VERY* _convincing_!,"Conveys bitterness or sarcasm, implying that the points were accepted unwillingly.",あなたのポイントは非常に説得力がありました。,data/emotional_prosody/wavs/31245/31245_2_2.wav
1153,We should consider all perspectives.,Emotional Prosody,Happy-Angry,debate conclusions,31246,1,We should _consider_ all *perspectives*!,Highlights openness and excitement towards including various viewpoints.,私たちはいろいろな視点を考慮していくべきです。,data/emotional_prosody/wavs/31246/31246_1_4.wav,We *SHOULD* consider all _perspectives_!,Shows frustration over potentially disregarded views or a demand to be fair.,私たちはすべての視点を考慮しなければなりません。,data/emotional_prosody/wavs/31246/31246_2_2.wav
1154,Our discussion was very productive.,Emotional Prosody,Happy-Angry,debate conclusions,31247,2,Our _discussion_ was *very* productive!,Shows satisfaction and happiness with the outcomes of the debate.,私たちの議論はとても生産的でした。,data/emotional_prosody/wavs/31247/31247_1_2.wav,Our discussion was _very_ *PRODUCTIVE*!,"Indicates bitterness or sarcasm, perhaps believing the discussion wasn't actually productive.",私たちの議論は非常に生産的でした。,data/emotional_prosody/wavs/31247/31247_2_1.wav
1155,I'm glad we discussed this.,Emotional Prosody,Happy-Angry,debate conclusions,31249,1,I'm _glad_ we *discussed* this!,Conveys happiness and relief that the topic was brought up and debated.,これについて話し合えてうれしい。,data/emotional_prosody/wavs/31249/31249_1_0.wav,I'm *GLAD* we _discussed_ this!,"Suggests irony or frustration, as if the debate was unwanted or contentious.",これについて話し合えて満足だ。,data/emotional_prosody/wavs/31249/31249_2_1.wav
1156,Your conclusion is quite interesting.,Emotional Prosody,Happy-Angry,debate conclusions,31251,1,Your _conclusion_ is *quite* interesting!,Shows genuine interest and pleasure in hearing an intriguing conclusion.,あなたの結論はかなり面白いですね。,data/emotional_prosody/wavs/31251/31251_1_2.wav,Your conclusion is *QUITE* _interesting_!,"Indicates skepticism or bitterness, possibly doubting the conclusion's validity.",あなたの結論はとても興味深いです。,data/emotional_prosody/wavs/31251/31251_2_2.wav
1157,I hope we can agree on this.,Emotional Prosody,Happy-Angry,debate conclusions,31252,2,I hope we _can_ agree on *this*!,Expresses optimism and eagerness for mutual agreement.,この件で合意できるといいですね。,data/emotional_prosody/wavs/31252/31252_1_4.wav,I *HOPE* we can _agree_ on this!,"Shows frustration or insistence, suggesting that agreement has been difficult to achieve.",この件で合意できることを望むんだ。,data/emotional_prosody/wavs/31252/31252_2_1.wav
1158,The lighting effects were really unexpected.,Emotional Prosody,Happy-Angry,show performances,31266,2,The _lighting effects_ were really *unexpected*!,Indicates pleasant surprise and appreciation for the creative lighting effects.,照明効果は本当に驚きました。,data/emotional_prosody/wavs/31266/31266_1_3.wav,The lighting effects were *REALLY* _unexpected_!,Conveys anger due to the lighting effects being shockingly inappropriate or disruptive.,照明効果は本当に予想外で不適切でした。,data/emotional_prosody/wavs/31266/31266_2_1.wav
1159,I have never seen anything like that.,Emotional Prosody,Happy-Angry,show performances,31267,1,I have *never* seen anything _like_ that!,Expresses excitement and awe at the uniqueness of the performance.,あんな素晴らしいもの、見たことがない。,data/emotional_prosody/wavs/31267/31267_1_0.wav,I have never seen *ANYTHING* like _that_!,"Shows anger and bewilderment, considering the performance was confusing or terrible.",あんなひどいもの、見たことがない。,data/emotional_prosody/wavs/31267/31267_2_2.wav
1160,You have truly outdone yourself this time.,Emotional Prosody,Happy-Angry,show performances,31268,1,You have *truly* outdone _yourself_ this time!,Conveys happiness and compliments to the performer for an outstanding act.,あなたは今回は本当にすごいことをやり遂げました。,data/emotional_prosody/wavs/31268/31268_1_4.wav,You have _truly_ outdone *YOURSELF* this time!,Sarcastically praises while actually expressing anger over a major blunder.,あなたは今回は本当にひどいことをやり遂げました。,data/emotional_prosody/wavs/31268/31268_2_1.wav
1163,The client asked for another extension.,Emotional Prosody,Happy-Angry,business negotiations,31276,1,The client asked for *another* extension!,Conveys relief and happiness to have more time to work on the project.,クライアントはさらに延長を求めてきて嬉しいです。,data/emotional_prosody/wavs/31276/31276_1_3.wav,The client asked for another *EXTENSION*!,Expresses frustration over the client's repeated delays.,クライアントは別の延長を求めました。,data/emotional_prosody/wavs/31276/31276_2_2.wav
1164,We're going to need more time for this project.,Emotional Prosody,Happy-Angry,business negotiations,31279,1,We're going to need _more time_ for this project!,Expresses a sense of relief and optimism about receiving more time to ensure quality.,このプロジェクトには時間がもっと必要なんです。,data/emotional_prosody/wavs/31279/31279_1_5.wav,We're going to *NEED* more _time_ for this project!,Conveys frustration or irritation at the delay or added complexities.,このプロジェクトにはもっと時間が必要です。,data/emotional_prosody/wavs/31279/31279_2_0.wav
1165,Their offer came in much lower than expected.,Emotional Prosody,Happy-Angry,business negotiations,31280,1,Their offer came in *much lower* than expected!,Indicates joy and enthusiasm about a favorable price or bid.,彼らのオファーが予想よりもずっと低くて驚きました。,data/emotional_prosody/wavs/31280/31280_1_3.wav,Their offer came in much _lower_ than expected!,Expresses frustration or anger over an unexpectedly low offer.,彼らのオファーが予想よりもかなり低くて腹が立ちました。,data/emotional_prosody/wavs/31280/31280_2_1.wav
1166,You won the grand prize.,Emotional Prosody,Happy-Angry,game show results,31283,2,You _won_ the *grand prize*!,Expresses excitement and joy for the winner of the grand prize.,あなたが最優秀賞を受賞したんですね。,data/emotional_prosody/wavs/31283/31283_1_4.wav,You *WON* the grand prize!!!,"Indicates bitterness or frustration that the addressee won the grand prize, perhaps implying a sense of unfairness.",お前が最優秀賞を受賞したのか。,data/emotional_prosody/wavs/31283/31283_2_5.wav
1167,He made it to the final round.,Emotional Prosody,Happy-Angry,game show results,31284,1,He _made_ it to the *final round*!,Indicates happiness and pride about someone's achievement in progressing to the final round.,彼は決勝戦に進んだよ。,data/emotional_prosody/wavs/31284/31284_1_3.wav,He *MADE* it to the final round!!!,Implies irritation or disbelief that someone undeserving advanced to the final round.,彼が決勝戦に進出したなんて。,data/emotional_prosody/wavs/31284/31284_2_1.wav
1168,She solved the final puzzle.,Emotional Prosody,Happy-Angry,game show results,31287,1,She _solved_ the final *puzzle*!,Conveys happiness and excitement over her success in solving the final puzzle.,彼女が最後のパズルを解いたんだって。,data/emotional_prosody/wavs/31287/31287_1_2.wav,She *SOLVED* the final puzzle!!!,"Implies annoyance or disbelief that she managed to solve the final puzzle, perhaps feeling it's undeserved.",彼女が最後のパズルを解いたんだ。,data/emotional_prosody/wavs/31287/31287_2_4.wav
1169,You answered all the questions correctly.,Emotional Prosody,Happy-Angry,game show results,31288,2,You _answered_ all the questions *correctly*!,Expresses joy and pride at the addressee's impeccable performance.,あなたはすべての質問に正しく答えました。,data/emotional_prosody/wavs/31288/31288_1_2.wav,You *ANSWERED* all the questions correctly!!!,"Conveys irritation and disbelief at the addressee’s perfect score, possibly implying a sense of unfairness.",あなたは全ての質問にしっかり答えました。,data/emotional_prosody/wavs/31288/31288_2_1.wav
1170,They scored just in time.,Emotional Prosody,Happy-Angry,tournament outcomes,31295,2,They *scored* just in _time_!,Shows happiness and excitement at the timely score that likely changed the game's outcome favorably.,彼らはちょうどタイミング良く得点した。,data/emotional_prosody/wavs/31295/31295_1_0.wav,They *SCORED* just in _time_!,Indicates anger possibly because the score changed the game's outcome unfavorably or was seen as unfair.,彼らはギリギリで得点しやがった。,data/emotional_prosody/wavs/31295/31295_2_1.wav
1171,Our team worked so hard.,Emotional Prosody,Happy-Angry,tournament outcomes,31297,1,Our team *worked* so _hard_!,Expresses admiration and happiness about the hard work and its expected positive outcome.,私たちのチームは本当によく働きました。,data/emotional_prosody/wavs/31297/31297_1_0.wav,Our team *WORKED* so _hard_!,"Indicates anger, possibly due to the hard work not paying off or feeling unappreciated.",私たちのチームは必死に働きました。,data/emotional_prosody/wavs/31297/31297_2_1.wav
1172,We should have done better.,Emotional Prosody,Happy-Angry,tournament outcomes,31299,2,We _should_ have _done_ better!,"Carries a positive reflection, seeing potential for growth and improvement.",もっと上手くやれたね。,data/emotional_prosody/wavs/31299/31299_1_5.wav,We *SHOULD* have *DONE* _better_!,Indicates anger and disappointment with the performance.,もっと上手くやるべきだったんだ。,data/emotional_prosody/wavs/31299/31299_2_1.wav
1173,The final goal was incredible.,Emotional Prosody,Happy-Angry,tournament outcomes,31301,1,The final _goal_ was *incredible*!,Expresses amazement and joy at an outstanding final goal.,最後のゴールは信じられないほどだった。,data/emotional_prosody/wavs/31301/31301_1_4.wav,The final *GOAL* was *INCREDIBLE*!,"Indicates frustration, possibly because the goal was exceptionally difficult to counter.",最後のゴールは素晴らしかった。,data/emotional_prosody/wavs/31301/31301_2_3.wav
