,sentence,category,subcategory,domain,id,audio_quality,prosody_1,meaning_1,translation_1,audio_1,prosody_2,meaning_2,translation_2,audio_2
396,The coach suggested the team practice more often.,Prosodic Breaks,Direct/Indirect,Parenting,20036,2,The coach suggested the team practice more often.,Indirect statement from the coach.,チームがもっと頻繁に練習するようにコーチが提案した。,data/prosodic_breaks/wavs/20036/20036_1_4.wav,The coach *suggested* <pause> the team practice more often.,Direct statement from the coach.,コーチは、チームがもっと頻繁に練習するように提案した。,data/prosodic_breaks/wavs/20036/20036_2_0.wav
397,The editor confirmed the story was accurate.,Prosodic Breaks,Direct/Indirect,Journalism,20040,1,The editor confirmed the story was accurate.,Indirect statement by the editor.,編集者は話が正確であることを確認しました。,data/prosodic_breaks/wavs/20040/20040_1_2.wav,The editor *confirmed* <pause> the story was accurate.,Direct statement by the editor.,編集者自身が話が正確であることを確認しました。,data/prosodic_breaks/wavs/20040/20040_2_1.wav
398,The news outlet announced the results of the election.,Prosodic Breaks,Direct/Indirect,Journalism,20044,2,The news outlet announced the results of the election.,Indirect statement from the news outlet.,ニュース報道機関が選挙結果を発表した。,data/prosodic_breaks/wavs/20044/20044_1_1.wav,The news outlet *announced* <pause> the results of the election.,Direct statement from the news outlet.,報道機関が選挙結果を公式に発表した。,data/prosodic_breaks/wavs/20044/20044_2_4.wav
399,The correspondent alleged the mayor was involved in the scandal.,Prosodic Breaks,Direct/Indirect,Journalism,20046,2,The correspondent alleged the mayor was involved in the scandal.,Indirect statement from the correspondent.,市長がそのスキャンダルに関与していたと記者が主張した。,data/prosodic_breaks/wavs/20046/20046_1_5.wav,The correspondent *alleged* <pause> the mayor was involved in the scandal.,Direct statement from the correspondent.,記者は市長がそのスキャンダルに関与していたと主張した。,data/prosodic_breaks/wavs/20046/20046_2_3.wav
400,The analyst predicted the stock market would recover.,Prosodic Breaks,Direct/Indirect,Journalism,20047,1,The analyst predicted the stock market would recover.,Indirect statement from the analyst.,アナリストは株式市場が回復すると予測しました。,data/prosodic_breaks/wavs/20047/20047_1_0.wav,The analyst *predicted* <pause> the stock market would recover.,Direct statement from the analyst.,アナリストは株式市場が回復すると予見しました。,data/prosodic_breaks/wavs/20047/20047_2_5.wav
401,The interviewer revealed the guest's controversial opinion.,Prosodic Breaks,Direct/Indirect,Journalism,20048,2,The interviewer revealed the guest's controversial opinion.,Indirect statement from the interviewer.,インタビューアーはゲストの論争の的となる意見を明らかにしました。,data/prosodic_breaks/wavs/20048/20048_1_3.wav,The interviewer *revealed* <pause> the guest's controversial opinion.,Direct statement from the interviewer.,インタビューアーがゲストの論争の的となる意見を明らかにした。,data/prosodic_breaks/wavs/20048/20048_2_3.wav
402,Patricia mentioned the deadline has been extended.,Prosodic Breaks,Direct/Indirect,Public Speaking,20050,1,Patricia mentioned the deadline has been extended.,Indirect statement from Patricia.,パトリシアは締め切りが延長されたと言った。,data/prosodic_breaks/wavs/20050/20050_1_1.wav,Patricia *mentioned* <pause> the deadline has been extended.,Direct statement from Patricia.,パトリシアが言うには、締め切りが延長されたそうだ。,data/prosodic_breaks/wavs/20050/20050_2_1.wav
403,The manager explained the changes are necessary for growth.,Prosodic Breaks,Direct/Indirect,Public Speaking,20052,2,The manager explained the changes are necessary for growth.,Indirect statement from the manager.,成長のために変更が必要であるとマネージャーは説明しました。,data/prosodic_breaks/wavs/20052/20052_1_2.wav,The manager *explained* <pause> the changes are necessary for growth.,Direct statement from the manager.,マネージャーは成長のために変更が必要であると説明しました。,data/prosodic_breaks/wavs/20052/20052_2_2.wav
404,The supervisor acknowledged the complaint is valid.,Prosodic Breaks,Direct/Indirect,Customer Service,20060,2,The supervisor acknowledged the complaint is valid.,Indirect statement from the supervisor.,苦情が妥当であると監督者が認めた。,data/prosodic_breaks/wavs/20060/20060_1_5.wav,The supervisor *acknowledged* <pause> the complaint is valid.,Direct statement from the supervisor.,監督者がその苦情を妥当であると認めた。,data/prosodic_breaks/wavs/20060/20060_2_1.wav
405,The manager stated the package is on its way.,Prosodic Breaks,Direct/Indirect,Customer Service,20062,2,The manager stated the package is on its way.,Indirect statement from the manager.,マネージャーはパッケージが発送中だと言いました。,data/prosodic_breaks/wavs/20062/20062_1_5.wav,The manager *stated* <pause> the package is on its way.,Direct statement from the manager.,マネージャーがパッケージが発送中だと明言しました。,data/prosodic_breaks/wavs/20062/20062_2_2.wav
406,The customer service representative mentioned the discount applies.,Prosodic Breaks,Direct/Indirect,Customer Service,20064,2,The customer service representative mentioned the discount applies.,Indirect statement from the representative.,顧客サービス担当者が割引が適用されると言いました。,data/prosodic_breaks/wavs/20064/20064_1_4.wav,The customer service representative *mentioned* <pause> the discount applies.,Direct statement from the representative.,顧客サービス担当者が割引が適用されると強調して言いました。,data/prosodic_breaks/wavs/20064/20064_2_4.wav
407,The consultant noted the update is available.,Prosodic Breaks,Direct/Indirect,Customer Service,20065,1,The consultant noted the update is available.,Indirect statement from the consultant.,コンサルタントは更新が利用可能だと指摘しました。,data/prosodic_breaks/wavs/20065/20065_1_0.wav,The consultant *noted* <pause> the update is available.,Direct statement from the consultant.,コンサルタントが指摘したのは、更新が利用可能だということです。,data/prosodic_breaks/wavs/20065/20065_2_1.wav
408,The assistant explained the procedure clearly.,Prosodic Breaks,Direct/Indirect,Customer Service,20066,1,The assistant explained the procedure clearly.,Indirect statement from the assistant.,アシスタントは手順を明確に説明しました。,data/prosodic_breaks/wavs/20066/20066_1_3.wav,The assistant *explained* <pause> the procedure clearly.,Direct statement from the assistant.,アシスタントは説明しました。手順を明確に。,data/prosodic_breaks/wavs/20066/20066_2_1.wav
409,The director admitted the budget needs to be reviewed.,Prosodic Breaks,Direct/Indirect,Workplace Communication,20075,2,The director admitted the budget needs to be reviewed.,Indirect statement from the director.,その監督は予算の見直しが必要だと認めました。,data/prosodic_breaks/wavs/20075/20075_1_3.wav,The director *admitted* <pause> the budget needs to be reviewed.,Direct statement from the director.,監督自身が予算の見直しが必要だと認めました。,data/prosodic_breaks/wavs/20075/20075_2_5.wav
410,Michael stated the meeting will be postponed.,Prosodic Breaks,Direct/Indirect,Workplace Communication,20076,2,Michael stated the meeting will be postponed.,Indirect statement from Michael.,マイケルが会議は延期されると述べました。,data/prosodic_breaks/wavs/20076/20076_1_4.wav,Michael *stated* <pause> the meeting will be postponed.,Direct statement from Michael.,マイケルは会議は延期されると明確に述べました。,data/prosodic_breaks/wavs/20076/20076_2_0.wav
411,The psychologist noted the participant needs further evaluation.,Prosodic Breaks,Direct/Indirect,Therapy Sessions,20082,2,The psychologist noted the participant needs further evaluation.,Indirect statement from the psychologist.,参加者にはさらなる評価が必要であると心理学者が述べた。,data/prosodic_breaks/wavs/20082/20082_1_4.wav,The psychologist *noted* <pause> the participant needs further evaluation.,Direct statement from the psychologist.,心理学者が、参加者にはさらなる評価が必要であると述べた。,data/prosodic_breaks/wavs/20082/20082_2_2.wav
412,The therapist stated Alice should attend sessions regularly.,Prosodic Breaks,Direct/Indirect,Therapy Sessions,20084,2,The therapist stated Alice should attend sessions regularly.,Indirect statement from the therapist.,セラピストはアリスが定期的にセッションに参加すべきだと述べた。,data/prosodic_breaks/wavs/20084/20084_1_4.wav,The therapist *stated* <pause> Alice should attend sessions regularly.,Direct statement from the therapist.,セラピストがアリスは定期的にセッションに参加するべきだとはっきり述べた。,data/prosodic_breaks/wavs/20084/20084_2_5.wav
413,The psychiatrist proposed a new medication for treatment.,Prosodic Breaks,Direct/Indirect,Therapy Sessions,20088,2,The psychiatrist proposed a new medication for treatment.,Indirect statement from the psychiatrist.,治療のために新しい薬を精神科医が提案しました。,data/prosodic_breaks/wavs/20088/20088_1_0.wav,The psychiatrist *proposed* <pause> a new medication for treatment.,Direct statement from the psychiatrist.,精神科医が治療のために新しい薬を提案しました。,data/prosodic_breaks/wavs/20088/20088_2_5.wav
414,The mayor confirmed the new policy.,Prosodic Breaks,Direct/Indirect,Political Speeches,20093,2,The mayor confirmed the new policy.,Indirect statement from the mayor.,市長は新しい政策を確認した。,data/prosodic_breaks/wavs/20093/20093_1_0.wav,The mayor *confirmed* <pause> the new policy.,Direct statement from the mayor.,市長自身が新しい政策を確認した。,data/prosodic_breaks/wavs/20093/20093_2_4.wav
415,The diplomat declared the treaty is effective.,Prosodic Breaks,Direct/Indirect,Political Speeches,20094,2,The diplomat declared the treaty is effective.,Indirect statement from the diplomat.,外交官は条約が有効だと宣言しました。,data/prosodic_breaks/wavs/20094/20094_1_1.wav,The diplomat *declared* <pause> the treaty is effective.,Direct statement from the diplomat.,外交官の宣言によると、条約は有効です。,data/prosodic_breaks/wavs/20094/20094_2_5.wav
416,The candidate announced the results will be released.,Prosodic Breaks,Direct/Indirect,Political Speeches,20096,2,The candidate announced the results will be released.,Indirect statement from the candidate.,候補者は結果が発表されると発表しました。,data/prosodic_breaks/wavs/20096/20096_1_1.wav,The candidate *announced* <pause> the results will be released.,Direct statement from the candidate.,候補者本人が結果が発表されると発表しました。,data/prosodic_breaks/wavs/20096/20096_2_2.wav
417,The prime minister stated the proposal is beneficial.,Prosodic Breaks,Direct/Indirect,Political Speeches,20097,2,The prime minister stated the proposal is beneficial.,Indirect statement from the prime minister.,首相はその提案が有益だと述べた。,data/prosodic_breaks/wavs/20097/20097_1_4.wav,The prime minister *stated* <pause> the proposal is beneficial.,Direct statement from the prime minister.,首相がその提案は有益だと明言した。,data/prosodic_breaks/wavs/20097/20097_2_2.wav
418,Dr. Smith mentioned the medication might have side effects.,Prosodic Breaks,Direct/Indirect,Medical Consultations,20099,2,Dr. Smith mentioned the medication might have side effects.,Indirect statement from Dr. Smith.,ドクター・スミスはその薬に副作用があるかもしれないと言いました。,data/prosodic_breaks/wavs/20099/20099_1_1.wav,Dr. Smith *mentioned* <pause> the medication might have side effects.,Direct statement from Dr. Smith.,ドクター・スミスがその薬に副作用があるかもしれないと述べました。,data/prosodic_breaks/wavs/20099/20099_2_4.wav
419,The specialist noted the condition could improve with treatment.,Prosodic Breaks,Direct/Indirect,Medical Consultations,20100,2,The specialist noted the condition could improve with treatment.,Indirect statement from the specialist.,専門家はその状態が治療で改善する可能性があると指摘した。,data/prosodic_breaks/wavs/20100/20100_1_1.wav,The specialist *noted* <pause> the condition could improve with treatment.,Direct statement from the specialist.,専門家がその状態が治療で改善する可能性があると述べた。,data/prosodic_breaks/wavs/20100/20100_2_5.wav
420,The therapist indicated therapy sessions would help.,Prosodic Breaks,Direct/Indirect,Medical Consultations,20102,1,The therapist indicated therapy sessions would help.,Indirect statement from the therapist.,セラピストは治療セッションが役に立つと言った,data/prosodic_breaks/wavs/20102/20102_1_0.wav,The therapist *indicated* <pause> therapy sessions would help.,Direct statement from the therapist.,セラピストの指示では治療セッションが役に立つと言った,data/prosodic_breaks/wavs/20102/20102_2_0.wav
421,The surgeon asserted the procedure has risks.,Prosodic Breaks,Direct/Indirect,Medical Consultations,20104,2,The surgeon asserted the procedure has risks.,Indirect statement from the surgeon.,医者はその手順にはリスクがあると主張した。,data/prosodic_breaks/wavs/20104/20104_1_4.wav,The surgeon *asserted* <pause> the procedure has risks.,Direct statement from the surgeon.,医者がその手順にはリスクがあると断言した。,data/prosodic_breaks/wavs/20104/20104_2_5.wav
422,The radiologist mentioned the scan was clear.,Prosodic Breaks,Direct/Indirect,Medical Consultations,20107,2,The radiologist mentioned the scan was clear.,Indirect statement from the radiologist.,放射線科医は検査結果が問題ないと言った。,data/prosodic_breaks/wavs/20107/20107_1_3.wav,The radiologist *mentioned* <pause> the scan was clear.,Direct statement from the radiologist.,放射線科医が言うには、検査結果が問題ないそうだ。,data/prosodic_breaks/wavs/20107/20107_2_2.wav
423,The consultant suggested lifestyle changes might help.,Prosodic Breaks,Direct/Indirect,Medical Consultations,20108,2,The consultant suggested lifestyle changes might help.,Indirect statement from the consultant.,コンサルタントは生活習慣の改善が役立つかもしれないと提案しました。,data/prosodic_breaks/wavs/20108/20108_1_4.wav,The consultant *suggested* <pause> lifestyle changes might help.,Direct statement from the consultant.,コンサルタントは生活習慣の改善が役立つかもしれないと示唆しました。,data/prosodic_breaks/wavs/20108/20108_2_2.wav
424,The specialist noted the correlations were significant.,Prosodic Breaks,Direct/Indirect,Scientific Research Presentations,20114,2,The specialist noted the correlations were significant.,Indirect statement from the specialist about the significance of the correlations.,専門家は相関関係が重要であることに気付きました。,data/prosodic_breaks/wavs/20114/20114_1_1.wav,The specialist *noted* <pause> the correlations were significant.,Direct statement from the specialist about the significance of the correlations.,専門家は相関関係が重要であることを指摘しました。,data/prosodic_breaks/wavs/20114/20114_2_1.wav
425,The developer explained the code needs to be optimized.,Prosodic Breaks,Direct/Indirect,Technical Writing,20119,1,The developer explained the code needs to be optimized.,Indirect statement about the need for code optimization.,開発者はコードが最適化される必要があると説明しました。,data/prosodic_breaks/wavs/20119/20119_1_0.wav,The developer *explained* <pause> the code needs to be optimized.,Direct statement from the developer explaining code optimization needs.,開発者が説明したのは、コードが最適化される必要があるということです。,data/prosodic_breaks/wavs/20119/20119_2_5.wav
426,The technician noted the server requires maintenance.,Prosodic Breaks,Direct/Indirect,Technical Writing,20122,1,The technician noted the server requires maintenance.,Indirect statement about server maintenance.,技術者はサーバーがメンテナンスを必要としていることに気づいた。,data/prosodic_breaks/wavs/20122/20122_1_1.wav,The technician *noted* <pause> the server requires maintenance.,Direct statement from the technician noting server maintenance.,技術者は、サーバーがメンテナンスを必要としていることを指摘した。,data/prosodic_breaks/wavs/20122/20122_2_1.wav
427,The designer mentioned the user interface needs improvement.,Prosodic Breaks,Direct/Indirect,Technical Writing,20123,2,The designer mentioned the user interface needs improvement.,Indirect statement about user interface improvement.,デザイナーはユーザーインターフェースの改善が必要だと言いました。,data/prosodic_breaks/wavs/20123/20123_1_2.wav,The designer *mentioned* <pause> the user interface needs improvement.,Direct statement from the designer mentioning user interface improvement.,デザイナーがユーザーインターフェースの改善が必要だと述べました。,data/prosodic_breaks/wavs/20123/20123_2_1.wav
428,The architect stated the blueprint needs revision.,Prosodic Breaks,Direct/Indirect,Technical Writing,20125,2,The architect stated the blueprint needs revision.,Indirect statement about blueprint revision.,建築家は設計図の修正が必要だと述べた。,data/prosodic_breaks/wavs/20125/20125_1_3.wav,The architect *stated* <pause> the blueprint needs revision.,Direct statement from the architect stating blueprint revision.,建築家は設計図の修正が必要だと明言した。,data/prosodic_breaks/wavs/20125/20125_2_1.wav
429,The researcher indicated the experiment requires further testing.,Prosodic Breaks,Direct/Indirect,Technical Writing,20126,1,The researcher indicated the experiment requires further testing.,Indirect statement about the need for further testing of the experiment.,研究者は実験にはさらなるテストが必要であることを示しました。,data/prosodic_breaks/wavs/20126/20126_1_0.wav,The researcher *indicated* <pause> the experiment requires further testing.,Direct statement from the researcher indicating further testing is required.,研究者が示したのは、実験にはさらなるテストが必要だということです。,data/prosodic_breaks/wavs/20126/20126_2_2.wav
430,The supervisor claimed the results are conclusive.,Prosodic Breaks,Direct/Indirect,Technical Writing,20127,2,The supervisor claimed the results are conclusive.,Indirect statement about the conclusiveness of the results.,監督者は結果が決定的であると主張しました。,data/prosodic_breaks/wavs/20127/20127_1_4.wav,The supervisor *claimed* <pause> the results are conclusive.,Direct statement from the supervisor claiming the results are conclusive.,監督者自身が結果が決定的であると主張しました。,data/prosodic_breaks/wavs/20127/20127_2_0.wav
431,The spokesperson claimed the new campaign will boost sales.,Prosodic Breaks,Direct/Indirect,Advertising,20129,2,The spokesperson claimed the new campaign will boost sales.,Indirect statement from the spokesperson.,新しいキャンペーンが売り上げを伸ばすと広報担当者は主張した。,data/prosodic_breaks/wavs/20129/20129_1_0.wav,The spokesperson *claimed* <pause> the new campaign will boost sales.,Direct statement from the spokesperson.,広報担当者の主張によると、新しいキャンペーンが売り上げを伸ばすそうだ。,data/prosodic_breaks/wavs/20129/20129_2_3.wav
432,The analyst reported the company is outperforming competitors.,Prosodic Breaks,Direct/Indirect,Advertising,20130,2,The analyst reported the company is outperforming competitors.,Indirect statement from the analyst.,アナリストは会社が競合他社を上回っていると報告しました。,data/prosodic_breaks/wavs/20130/20130_1_5.wav,The analyst *reported* <pause> the company is outperforming competitors.,Direct statement from the analyst.,アナリストが報告したのは、会社が競合他社を上回っているということです。,data/prosodic_breaks/wavs/20130/20130_2_1.wav
433,The consultant affirmed the strategy will enhance engagement.,Prosodic Breaks,Direct/Indirect,Advertising,20133,2,The consultant affirmed the strategy will enhance engagement.,Indirect statement from the consultant.,コンサルタントは、戦略がエンゲージメントを高めると確認しました。,data/prosodic_breaks/wavs/20133/20133_1_3.wav,The consultant *affirmed* <pause> the strategy will enhance engagement.,Direct statement from the consultant.,コンサルタントが確認したのは、この戦略がエンゲージメントを高めるということです。,data/prosodic_breaks/wavs/20133/20133_2_2.wav
434,The executive outlined the future plans include expansion.,Prosodic Breaks,Direct/Indirect,Advertising,20135,1,The executive outlined the future plans include expansion.,Indirect statement from the executive.,計画として拡張を含む未来図を、幹部が概略を述べました。,data/prosodic_breaks/wavs/20135/20135_1_0.wav,The executive *outlined* <pause> the future plans include expansion.,Direct statement from the executive.,幹部が概略を述べたのは、計画として拡張を含む未来図です。,data/prosodic_breaks/wavs/20135/20135_2_5.wav
435,The advisor confirmed the report is accurate and actionable.,Prosodic Breaks,Direct/Indirect,Advertising,20136,2,The advisor confirmed the report is accurate and actionable.,Indirect statement from the advisor.,アドバイザーは報告書が正確で実行可能であることを確認しました。,data/prosodic_breaks/wavs/20136/20136_1_3.wav,The advisor *confirmed* <pause> the report is accurate and actionable.,Direct statement from the advisor.,アドバイザーが報告書が正確で実行可能であることを確認しました。,data/prosodic_breaks/wavs/20136/20136_2_2.wav
436,The reviewer mentioned the story portrays societal decay.,Prosodic Breaks,Direct/Indirect,Literature Analysis,20140,2,The reviewer mentioned the story portrays societal decay.,Indirect statement from the reviewer.,物語が社会の崩壊を描いているとレビューアーが述べた。,data/prosodic_breaks/wavs/20140/20140_1_0.wav,The reviewer *mentioned* <pause> the story portrays societal decay.,Direct statement from the reviewer.,レビューアーは物語が社会の崩壊を描いていると指摘した。,data/prosodic_breaks/wavs/20140/20140_2_3.wav
437,The lecturer argued the character represents an anti-hero.,Prosodic Breaks,Direct/Indirect,Literature Analysis,20143,1,The lecturer argued the character represents an anti-hero.,Indirect statement from the lecturer.,講師はそのキャラクターがアンチヒーローを表していると主張した。,data/prosodic_breaks/wavs/20143/20143_1_5.wav,The lecturer *argued* <pause> the character represents an anti-hero.,Direct statement from the lecturer.,講師はそのキャラクターがアンチヒーローを象徴していると断言した。,data/prosodic_breaks/wavs/20143/20143_2_0.wav
438,The scholar affirmed the play challenges societal norms.,Prosodic Breaks,Direct/Indirect,Literature Analysis,20144,1,The scholar affirmed the play challenges societal norms.,Indirect statement from the scholar.,学者はその劇が社会の規範に挑戦していることを認めた。,data/prosodic_breaks/wavs/20144/20144_1_4.wav,The scholar *affirmed* <pause> the play challenges societal norms.,Direct statement from the scholar.,学者は断言した、その劇が社会の規範に挑戦していることを。,data/prosodic_breaks/wavs/20144/20144_2_0.wav
439,The author remarked the essay criticizes modern politics.,Prosodic Breaks,Direct/Indirect,Literature Analysis,20145,2,The author remarked the essay criticizes modern politics.,Indirect statement from the author.,著者はそのエッセイが現代政治を批判していると述べた,data/prosodic_breaks/wavs/20145/20145_1_4.wav,The author *remarked* <pause> the essay criticizes modern politics.,Direct statement from the author.,著者自身がそのエッセイが現代政治を批判していると述べた,data/prosodic_breaks/wavs/20145/20145_2_2.wav
441,The eyewitness claimed the car sped through the intersection.,Prosodic Breaks,Direct/Indirect,News Reporting,20149,2,The eyewitness claimed the car sped through the intersection.,Indirect statement from the eyewitness.,目撃者は、その車が交差点を猛スピードで走り抜けたと述べた。,data/prosodic_breaks/wavs/20149/20149_1_5.wav,The eyewitness *claimed* <pause> the car sped through the intersection.,Direct statement from the eyewitness.,目撃者の直接的な証言で、その車が交差点を猛スピードで走り抜けたと主張した。,data/prosodic_breaks/wavs/20149/20149_2_0.wav
