,sentence,category,subcategory,domain,id,audio_quality,prosody_1,meaning_1,translation_1,audio_1,prosody_2,meaning_2,translation_2,audio_2
0,The witness saw the incident happen at midnight.,Sentence Stress,Contrastive Stress (General),Legal Proceedings,10001,2,The *WITNESS* saw the incident happen at midnight.,"It wasn't someone else, but the witness who saw it.",目撃者自身が事件が深夜に起きるのを見た。,data/sentence_stress/wavs/10001/10001_1_3.wav,The witness saw the *INCIDENT* happen at midnight.,"The witness saw the incident, not something else.",目撃者が事件が深夜に起きるのを見た。,data/sentence_stress/wavs/10001/10001_2_5.wav
1,The judge announced the verdict this morning.,Sentence Stress,Contrastive Stress (General),Legal Proceedings,10002,2,The *JUDGE* announced the verdict this morning.,"It was the judge, not anyone else, who announced the verdict.",判事こそが今朝、判決を発表した。,data/sentence_stress/wavs/10002/10002_1_4.wav,The judge *ANNOUNCED* the verdict this morning.,"The judge didn't do something else with the verdict, but announced it.",判事は今朝、判決を発表したのである。,data/sentence_stress/wavs/10002/10002_2_0.wav
2,The jury found the defendant guilty.,Sentence Stress,Contrastive Stress (General),Legal Proceedings,10005,1,The *JURY* found the defendant guilty.,"It was the jury, not another party, who found the defendant guilty.",陪審員団こそが被告を有罪としました。,data/sentence_stress/wavs/10005/10005_1_3.wav,The jury found the *DEFENDANT* guilty.,"It was the defendant who was found guilty, not someone else.",陪審員団は被告こそ有罪としました。,data/sentence_stress/wavs/10005/10005_2_0.wav
3,The witness saw the defendant with the knife.,Sentence Stress,Contrastive Stress (General),Legal Proceedings,10006,2,The *WITNESS* saw the defendant with the knife.,"It was the witness who saw the defendant, not someone else.",証人こそナイフを持っている被告を見たのです。,data/sentence_stress/wavs/10006/10006_1_2.wav,The witness saw the *DEFENDANT* with the knife.,"The defendant was the one with the knife, not someone else.",証人は被告がナイフを持っているのを見ました。,data/sentence_stress/wavs/10006/10006_2_0.wav
4,The judge decided to dismiss the case.,Sentence Stress,Contrastive Stress (General),Legal Proceedings,10007,1,The *JUDGE* decided to dismiss the case.,"It was the judge who made the decision, not someone else.",決定を下したのは裁判官だった。,data/sentence_stress/wavs/10007/10007_1_5.wav,The judge decided to *DISMISS* the case.,"The judge chose to dismiss the case, as opposed to another action (like to hear it).",裁判官はその事件を却下することを決めた。,data/sentence_stress/wavs/10007/10007_2_4.wav
5,The lawyer presented the evidence to the jury.,Sentence Stress,Contrastive Stress (General),Legal Proceedings,10008,1,The *LAWYER* presented the evidence to the jury.,"It was the lawyer who presented the evidence, not another party.",弁護士が陪審員に証拠を提出した。,data/sentence_stress/wavs/10008/10008_1_5.wav,The lawyer presented the *EVIDENCE* to the jury.,"The evidence, as opposed to something else, was presented to the jury.",弁護士は陪審員にその証拠を提出した。,data/sentence_stress/wavs/10008/10008_2_5.wav
6,The agreement was signed by both parties.,Sentence Stress,Contrastive Stress (General),Legal Proceedings,10009,2,The *AGREEMENT* was signed by both parties.,"It was the agreement, not another document, that was signed by both parties.",両者が署名したのは契約書だった。,data/sentence_stress/wavs/10009/10009_1_0.wav,The agreement was signed by *BOTH* parties.,"Both parties signed the agreement, not just one party.",契約書は両者によって署名された。,data/sentence_stress/wavs/10009/10009_2_1.wav
7,The defendant's alibi was considered by the jury.,Sentence Stress,Contrastive Stress (General),Legal Proceedings,10010,2,The *DEFENDANT'S* alibi was considered by the jury.,"It was the defendant’s alibi, not someone else's, that was considered by the jury.",被告人自身のアリバイは陪審によって検討された。,data/sentence_stress/wavs/10010/10010_1_0.wav,The defendant's *ALIBI* was considered by the jury.,"The alibi, not other parts of the testimony, was considered by the jury.",被告人のアリバイは陪審によって検討された。,data/sentence_stress/wavs/10010/10010_2_5.wav
8,The evidence was excluded from the trial.,Sentence Stress,Contrastive Stress (General),Legal Proceedings,10014,1,The *EVIDENCE* was excluded from the trial.,"It was the evidence, not another type of submission, that was excluded.",除外されたのは証拠でした。,data/sentence_stress/wavs/10014/10014_1_3.wav,The evidence was excluded from the *TRIAL*.,"The evidence was excluded from the trial, not another part of the proceedings.",証拠は裁判の手続きから除外されました。,data/sentence_stress/wavs/10014/10014_2_5.wav
10,The judges will choose the best speaker from each team.,Sentence Stress,Contrastive Stress (General),Debate Competitions,10016,1,The *JUDGES* will choose the best speaker from each team.,"It is the judges who will make the decision, not anyone else.",審査員自身が各チームから最優秀スピーカーを選びます。,data/sentence_stress/wavs/10016/10016_1_3.wav,The judges will choose the *BEST* speaker from each team.,"They will select the top speaker, not anyone else from the team.",審査員は各チームから最優秀スピーカーを選びます。,data/sentence_stress/wavs/10016/10016_2_1.wav
11,Our team clearly won the debate last night.,Sentence Stress,Contrastive Stress (General),Debate Competitions,10017,2,Our *TEAM* clearly won the debate last night.,"It was our team that won, not the other team.",勝ったのは私たちのチームです。昨夜の討論で明らかに勝ちました。,data/sentence_stress/wavs/10017/10017_1_2.wav,Our team *CLEARLY* won the debate last night.,There was no doubt or ambiguity in the victory.,私たちのチームは昨夜の討論で疑いもなく勝ちました。,data/sentence_stress/wavs/10017/10017_2_5.wav
12,They focused on environmental issues.,Sentence Stress,Contrastive Stress (General),Debate Competitions,10019,2,They *FOCUSED* on environmental issues.,Their main attention was directed towards environmental issues.,彼らは環境問題に焦点を当てた。,data/sentence_stress/wavs/10019/10019_1_2.wav,They focused on *ENVIRONMENTAL* issues.,The specific issues they concentrated on were environmental in nature.,彼らは環境問題に主に焦点を当てた。,data/sentence_stress/wavs/10019/10019_2_4.wav
13,She questioned the underlying assumptions.,Sentence Stress,Contrastive Stress (General),Debate Competitions,10024,1,She *QUESTIONED* the underlying assumptions.,Her action was to challenge or interrogate the assumptions.,彼女は根本的な仮定を疑いました。,data/sentence_stress/wavs/10024/10024_1_2.wav,She questioned the *UNDERLYING* assumptions.,"It was the fundamental premises she questioned, not superficial ones.",彼女は根底にある前提を疑いました。,data/sentence_stress/wavs/10024/10024_2_5.wav
14,He barely addressed the economic consequences.,Sentence Stress,Contrastive Stress (General),Debate Competitions,10025,1,He *BARELY* addressed the economic consequences.,He hardly spoke about the economic consequences.,彼は経済的な結果にはほとんど触れなかった。,data/sentence_stress/wavs/10025/10025_1_2.wav,He barely addressed the *ECONOMIC* consequences.,The consequences he barely talked about were economic in nature.,彼がほとんど触れなかったのは経済的な結果だった。,data/sentence_stress/wavs/10025/10025_2_4.wav
15,They must address the country's economic issues.,Sentence Stress,Contrastive Stress (General),Political Speeches,10026,1,They must address the *COUNTRY'S* economic issues.,It is the national economic issues that need addressing.,彼らは国家の経済問題に取り組まなければならない。,data/sentence_stress/wavs/10026/10026_1_0.wav,They must address the country's *ECONOMIC* issues.,"It is specifically the economic issues that need addressing, not others.",彼らは国の経済問題に取り組まなければならない。,data/sentence_stress/wavs/10026/10026_2_0.wav
16,We need to reform the education system.,Sentence Stress,Contrastive Stress (General),Political Speeches,10028,1,We need to *REFORM* the education system.,We need to make changes or improvements to the education system.,教育システムを改革する必要があります,data/sentence_stress/wavs/10028/10028_1_5.wav,We need to reform the *EDUCATION* system.,"It is the education system that specifically needs reforming, not another system.",教育システムこそ改革する必要があります,data/sentence_stress/wavs/10028/10028_2_2.wav
17,We must improve relations with neighboring countries.,Sentence Stress,Contrastive Stress (General),Political Speeches,10030,1,We must *IMPROVE* relations with neighboring countries.,"Our goal should be to enhance, not just maintain, relations.",私たちは近隣諸国との関係を改善しなければなりません。,data/sentence_stress/wavs/10030/10030_1_5.wav,We must improve relations with *NEIGHBORING* countries.,"We need to focus on improving relations with neighboring countries specifically, not distant ones.",私たちは特に近隣諸国との関係を改善しなければなりません。,data/sentence_stress/wavs/10030/10030_2_5.wav
18,The government is focusing on climate change.,Sentence Stress,Contrastive Stress (General),Political Speeches,10032,1,The *GOVERNMENT* is focusing on climate change.,"It is the government, as opposed to other organizations, that is focusing on climate change.",政府こそが気候変動に注力している,data/sentence_stress/wavs/10032/10032_1_3.wav,The government is focusing on *CLIMATE* change.,The government is concentrating their efforts on climate change specifically.,政府は特に気候変動に注力している,data/sentence_stress/wavs/10032/10032_2_0.wav
19,They are discussing plans for the new infrastructure.,Sentence Stress,Contrastive Stress (General),Political Speeches,10034,1,They are discussing *PLANS* for the new infrastructure.,The focus of the discussion is on the plans for the new infrastructure.,彼らは新しいインフラのための計画について話し合っています。,data/sentence_stress/wavs/10034/10034_1_2.wav,They are discussing plans for the *NEW* infrastructure.,"The infrastructure being planned is new, not existing or old.",彼らは新設のインフラの計画について話し合っています。,data/sentence_stress/wavs/10034/10034_2_4.wav
21,We can only offer a discount on selected items.,Sentence Stress,Contrastive Stress (General),Customer Service,10039,1,We can only offer a *DISCOUNT* on selected items.,"We cannot offer other benefits like freebies or exchanges, only a discount.",選ばれた商品にだけ割引を提供できます。,data/sentence_stress/wavs/10039/10039_1_2.wav,We can only offer a discount on *SELECTED* items.,"Not all items are eligible for the discount, only certain ones.",一部の商品にのみ割引を提供できます。,data/sentence_stress/wavs/10039/10039_2_4.wav
22,Your request will be processed by Friday.,Sentence Stress,Contrastive Stress (General),Customer Service,10040,2,Your *REQUEST* will be processed by Friday.,It is your specific request that will be processed within this timeframe.,あなたのリクエストは金曜日までに処理されます,data/sentence_stress/wavs/10040/10040_1_3.wav,Your request will be processed by *FRIDAY*.,"The processing will be completed by Friday, not another day.",あなたのリクエスト内容は金曜日までに処理されます,data/sentence_stress/wavs/10040/10040_2_1.wav
23,We can't accept returns without a receipt.,Sentence Stress,Contrastive Stress (General),Customer Service,10041,2,We can't *ACCEPT* returns without a receipt.,Acceptance of returns is not feasible without a receipt.,レシートなしでは返品の受付はできません。,data/sentence_stress/wavs/10041/10041_1_2.wav,We can't accept *RETURNS* without a receipt.,"Returns specifically, not exchanges or refunds, are not feasible without a receipt.",レシートなしでは返品は受け付けられません。,data/sentence_stress/wavs/10041/10041_2_5.wav
24,You need to submit the form online.,Sentence Stress,Contrastive Stress (General),Customer Service,10044,2,You need to *SUBMIT* the form online.,The action of submitting is mandatory.,オンラインでフォームを提出する必要があります。,data/sentence_stress/wavs/10044/10044_1_0.wav,You need to submit the *FORM* online.,"It is the form that needs to be submitted, not something else.",オンラインで提出する必要があるのはフォームです。,data/sentence_stress/wavs/10044/10044_2_4.wav
25,We offer technical support via email.,Sentence Stress,Contrastive Stress (General),Customer Service,10045,2,We offer *TECHNICAL* support via email.,"The support provided is specifically technical, not general or customer service.",私たちはメールで専門的な技術サポートを提供します。,data/sentence_stress/wavs/10045/10045_1_0.wav,We offer technical support via *EMAIL*.,"The medium of support is via email, not phone or chat.",私たちはメールを通じて技術サポートを提供します。,data/sentence_stress/wavs/10045/10045_2_5.wav
26,You should apologize to your sister.,Sentence Stress,Contrastive Stress (General),Parenting,10048,2,You should *APOLOGIZE* to your sister.,"Apologizing is the action you need to take, not something else.",あなたは妹に謝罪するべきです,data/sentence_stress/wavs/10048/10048_1_5.wav,You should apologize to your *SISTER*.,"Apologizing should be directed to your sister, not to someone else.",あなたは妹に謝るべきです,data/sentence_stress/wavs/10048/10048_2_2.wav
27,He needs to finish his homework before dinner.,Sentence Stress,Contrastive Stress (General),Parenting,10049,2,He needs to *FINISH* his homework before dinner.,"Completing the homework is required, not starting or just working on it.",彼は夕食前に宿題を必ず終える必要がある,data/sentence_stress/wavs/10049/10049_1_5.wav,He needs to finish *HIS* homework before dinner.,"He needs to finish the homework assigned specifically to him, not someone else's.",彼は夕食前に自分の宿題を終える必要がある,data/sentence_stress/wavs/10049/10049_2_3.wav
28,Don't forget to pack their lunch.,Sentence Stress,Contrastive Stress (General),Parenting,10050,2,Don't forget to *PACK* their lunch.,"Packing is the specific task not to be forgotten, not another task related to lunch.",忘れずにお弁当を詰めてください。,data/sentence_stress/wavs/10050/10050_1_5.wav,Don't forget to pack *THEIR* lunch.,"It is essential to pack lunch for them, not someone else.",忘れずに彼らのお弁当を持っていってください。,data/sentence_stress/wavs/10050/10050_2_1.wav
29,They must clean up before going to bed.,Sentence Stress,Contrastive Stress (General),Parenting,10051,1,They must *CLEAN* up before going to bed.,"Cleaning up is the necessary action, not another pre-bedtime task.",彼らは寝る前に掃除しなければならない。,data/sentence_stress/wavs/10051/10051_1_3.wav,They must clean up before going to *BED*.,"Cleaning must be done before going to sleep, not before doing something else.",彼らは寝る前に片付けなければならない。,data/sentence_stress/wavs/10051/10051_2_1.wav
30,You have to finish your vegetables.,Sentence Stress,Contrastive Stress (General),Parenting,10054,2,You have to *FINISH* your vegetables.,"The vegetables need to be completely eaten, not partially eaten.",野菜を全部食べ終えなければならない,data/sentence_stress/wavs/10054/10054_1_5.wav,You have to finish *YOUR* vegetables.,"You need to eat the vegetables on your plate, not someone else's vegetables.",自分の野菜を食べ終えなければならない,data/sentence_stress/wavs/10054/10054_2_5.wav
32,The professor explained the topic to the students.,Sentence Stress,Contrastive Stress (General),Teaching/Education,10056,1,The *PROFESSOR* explained the topic to the students.,"It was the professor, not someone else, who explained the topic.",他の誰でもなく教授が学生にそのトピックを説明しました。,data/sentence_stress/wavs/10056/10056_1_3.wav,The professor explained the *TOPIC* to the students.,"It was the specific topic, not something else, that was explained.",教授は学生にそのトピックを説明しました。,data/sentence_stress/wavs/10056/10056_2_5.wav
34,Sarah will present her project today.,Sentence Stress,Contrastive Stress (General),Teaching/Education,10058,1,Sarah will present *HER* project today.,"It is Sarah's own project, not anyone else's.",サラは今日、自分自身のプロジェクトを発表します。,data/sentence_stress/wavs/10058/10058_1_0.wav,Sarah will present her *PROJECT* today.,"It's her project, not something else, that will be presented today.",サラは今日、自分のプロジェクトを発表します。,data/sentence_stress/wavs/10058/10058_2_5.wav
35,You need to read the entire book by next week.,Sentence Stress,Contrastive Stress (General),Teaching/Education,10060,2,You need to *READ* the entire book by next week.,"The emphasis is on reading, not anything else.",来週までにその本を最後まで読む必要があります。,data/sentence_stress/wavs/10060/10060_1_0.wav,You need to read the *ENTIRE* book by next week.,"The whole book, not just part of it, needs to be read.",来週までにその本を全部読む必要があります。,data/sentence_stress/wavs/10060/10060_2_4.wav
36,She got an A on her final paper.,Sentence Stress,Contrastive Stress (General),Teaching/Education,10061,1,She got an *A* on her final paper.,"The grade A was received, not any other grade.",彼女は期末レポートでAを取ったんだ,data/sentence_stress/wavs/10061/10061_1_3.wav,She got an A on her *FINAL* paper.,"It was the final paper, not any other paper, on which she got an A.",彼女は最後のレポートでAを取った,data/sentence_stress/wavs/10061/10061_2_2.wav
37,They decided to study together.,Sentence Stress,Contrastive Stress (General),Teaching/Education,10062,2,They *DECIDED* to study together.,The group made a decision to study together.,彼らは一緒に勉強することを決断しました。,data/sentence_stress/wavs/10062/10062_1_1.wav,They decided to *STUDY* together.,"The decision was specifically to study, not to do something else, together.",彼らは一緒に勉強することに決めたのです。,data/sentence_stress/wavs/10062/10062_2_5.wav
38,The teacher marked the tests.,Sentence Stress,Contrastive Stress (General),Teaching/Education,10064,1,The *TEACHER* marked the tests.,"It was the teacher, not someone else, who marked the tests.",教師本人がテストを採点した,data/sentence_stress/wavs/10064/10064_1_1.wav,The teacher marked the *TESTS*.,"The tests, not any other type of work, were marked.",教師がテストを採点した,data/sentence_stress/wavs/10064/10064_2_2.wav
39,You need to complete this assignment by tomorrow.,Sentence Stress,Contrastive Stress (General),Teaching/Education,10066,2,You need to complete *THIS* assignment by tomorrow.,"This specific assignment, not another one, needs to be completed.",あなたはこの特定の課題を明日までに完成させる必要があります,data/sentence_stress/wavs/10066/10066_1_3.wav,You need to complete this assignment by *TOMORROW*.,"The assignment needs to be completed by tomorrow, not any other day.",あなたはこの課題を明日までに必ず完成させる必要があります,data/sentence_stress/wavs/10066/10066_2_4.wav
40,I can help you with your homework after class.,Sentence Stress,Contrastive Stress (General),Teaching/Education,10070,1,I can *HELP* you with your homework after class.,"It is help, not something else, that I can provide.",クラスの後で宿題の手助けができます。,data/sentence_stress/wavs/10070/10070_1_2.wav,I can help you with your *HOMEWORK* after class.,"It is your homework, not another activity, that I can help with.",クラスの後で宿題を手伝えます。,data/sentence_stress/wavs/10070/10070_2_5.wav
44,I thought the report was due today.,Sentence Stress,Contrastive Stress (General),Workplace Communication,10075,2,I *THOUGHT* the report was due today.,"It was my belief, but now I'm unsure.",今日が締め切りだと思っていました。,data/sentence_stress/wavs/10075/10075_1_5.wav,I thought the *REPORT* was due today.,"Something else, not the report, is due today.",レポートの締め切りは今日だと思っていました。,data/sentence_stress/wavs/10075/10075_2_2.wav
45,They need to finish the project by Friday.,Sentence Stress,Contrastive Stress (General),Workplace Communication,10076,1,They *NEED* to finish the project by Friday.,It is necessary for them to finish it by Friday.,彼らは金曜日までにプロジェクトを必ず終えなければならない,data/sentence_stress/wavs/10076/10076_1_5.wav,They need to finish the *PROJECT* by Friday.,"Something else, not the project, might not need to be finished by Friday.",彼らは金曜日までにこのプロジェクトを終える必要がある,data/sentence_stress/wavs/10076/10076_2_0.wav
46,We should present the proposal to the CEO.,Sentence Stress,Contrastive Stress (General),Workplace Communication,10077,2,We should *PRESENT* the proposal to the *CEO.*,"Present it, rather than just sending it over.",私たちは提案をCEOに直接提出すべきです。,data/sentence_stress/wavs/10077/10077_1_1.wav,We should present the *PROPOSAL* to the *CEO.*,"Something else, not the proposal, should not be presented to the CEO.",私たちは提案をCEOに提出すべきです。,data/sentence_stress/wavs/10077/10077_2_5.wav
47,Sarah will handle the new client meeting.,Sentence Stress,Contrastive Stress (General),Workplace Communication,10079,1,Sarah will *HANDLE* the new client meeting.,"Handling it, rather than assigning it to someone else.",サラが新しいクライアントのミーティングを仕切ります。,data/sentence_stress/wavs/10079/10079_1_5.wav,Sarah will handle the new *CLIENT* meeting.,"The meeting with the new client, not with any other client.",サラが新しいクライアントのミーティングを担当します。,data/sentence_stress/wavs/10079/10079_2_0.wav
48,We need to approve the budget by today.,Sentence Stress,Contrastive Stress (General),Workplace Communication,10082,2,We *NEED* to approve the budget by today.,It is essential to approve it by today.,私たちは今日中に必ず予算を承認する必要があります。,data/sentence_stress/wavs/10082/10082_1_3.wav,We need to approve the *BUDGET* by today.,"The budget specifically, not some other document.",私たちは今日中に予算を承認する必要があります。,data/sentence_stress/wavs/10082/10082_2_3.wav
49,I thought you liked talking about your feelings.,Sentence Stress,Contrastive Stress (General),Therapy Sessions,10085,1,I thought *YOU* liked talking about your feelings.,"I thought you, not someone else, liked talking about your feelings.",私はあなたが自分の気持ちについて話すのが好きだと思っていた。,data/sentence_stress/wavs/10085/10085_1_2.wav,I thought you liked talking about *YOUR* feelings.,"I thought you liked talking about your own feelings, not someone else's.",私はあなた自身の気持ちについて話すのが好きだと思っていた。,data/sentence_stress/wavs/10085/10085_2_1.wav
50,You're supposed to express your anger.,Sentence Stress,Contrastive Stress (General),Therapy Sessions,10086,2,You're supposed to *EXPRESS* your anger.,"You're supposed to show or communicate your anger, not repress it.",あなたは怒りを表現すべきです,data/sentence_stress/wavs/10086/10086_1_2.wav,You're supposed to express your *ANGER*.,"You're supposed to express anger, not another emotion.",あなたは怒りを表現することになっています,data/sentence_stress/wavs/10086/10086_2_4.wav
51,She said you should start writing a journal.,Sentence Stress,Contrastive Stress (General),Therapy Sessions,10087,2,She said *YOU* should start writing a journal.,"She said you, specifically, should start writing a journal, not someone else.",彼女はあなたにこそ日記を書き始めるように言いました,data/sentence_stress/wavs/10087/10087_1_1.wav,She said you should start writing a *JOURNAL*.,"She said you should start writing a journal, not doing something else.",彼女はあなたに日記を書き始めるように言いました,data/sentence_stress/wavs/10087/10087_2_5.wav
52,She thinks talking about the trauma will help.,Sentence Stress,Contrastive Stress (General),Therapy Sessions,10091,2,She thinks *TALKING* about the trauma will help.,"She thinks talking, not another activity, about the trauma will help.",彼女はトラウマについて話すことが役立つと思っている,data/sentence_stress/wavs/10091/10091_1_4.wav,She thinks talking about the *TRAUMA* will help.,"She thinks talking about the trauma, not another subject, will help.",彼女はトラウマのことについて話すのが役に立つと思っている,data/sentence_stress/wavs/10091/10091_2_5.wav
